{
  "$schema": "https://json-schema.org/draft/2020-12/schema",
  "type": "object",
  "properties": {
    "id": {
      "type": "string",
      "pattern": "^[a-z0-9]+(?:_[a-z0-9]+)*$"
    },
    "name": {
      "type": "string"
    },
    "description": {
      "type": "string"
    },
    "laws": {
      "minItems": 2,
      "type": "array",
      "items": {
        "type": "object",
        "properties": {
          "id": {
            "type": "string",
            "pattern": "^[a-z0-9]+(?:_[a-z0-9]+)*$"
          },
          "name": {
            "type": "string"
          },
          "description": {
            "type": "string"
          },
          "pp_cost": {
            "type": "number",
            "minimum": 0
          },
          "requires_vote": {
            "type": "boolean"
          },
          "allowed_gov_types": {
            "type": "array",
            "items": {
              "type": "string",
              "pattern": "^[a-z0-9]+(?:_[a-z0-9]+)*$"
            }
          },
          "modifiers": {
            "default": {},
            "type": "object",
            "propertyNames": {
              "type": "string",
              "pattern": "^[a-z0-9]+(?:_[a-z0-9]+)*$"
            },
            "additionalProperties": {
              "type": "number"
            }
          },
          "ideology_support_drift": {
            "default": {},
            "type": "object",
            "propertyNames": {
              "type": "string",
              "pattern": "^[a-z0-9]+(?:_[a-z0-9]+)*$"
            },
            "additionalProperties": {
              "type": "number"
            }
          }
        },
        "required": [
          "id",
          "name",
          "description",
          "pp_cost",
          "requires_vote"
        ],
        "additionalProperties": false
      }
    }
  },
  "required": [
    "id",
    "name",
    "description",
    "laws"
  ],
  "additionalProperties": false
}
